{
  "deck_title": "Angina and trimetazidine — doctor defense",
  "deck_path": "VMR RTM slideset_C-1, 25-26.pptx",
  "ward_limit": "Not essential. Not a survival drug. Class IIb in ESC 2024 CCS. Absent from AHA 2023 CCD. Do not use in Parkinson disease, pregnancy, breastfeeding, or creatinine clearance below 30 mL/min.",
  "one_sentence": "Angina is a mismatch, not only a tight artery. This drug changes fuel use when you cannot lower demand further. Europe allows that at Class IIb.",
  "groups": [
    {
      "id": "1-5",
      "title": "Slides 1 to 5 — leftover angina",
      "bridge": "The early slides are about the patient, not the molecule.",
      "claims": [
        {
          "slide": "1",
          "claim": "Trimetazidine is an essential part of therapy.",
          "status": "DO_NOT_SAY",
          "say": "It may be considered as add-on, or in a selected first combination, Class IIb.",
          "locator": "ESC 2024 CCS PDF p16 Table 4. Harrison L2-634 says second-line, not essential.",
          "ward": "Do not say essential.",
          "if_asked": "Essential is the slide title, not the guideline."
        },
        {
          "slide": "2",
          "claim": "40% said angina affected quality of life completely or very much. BRIDGE 2.",
          "status": "SLIDE_PAPER",
          "say": "Leftover angina is a real burden. The 40% is that survey.",
          "locator": "Slide 2 only.",
          "ward": "Do not cite Harrison for 40%.",
          "if_asked": "Quality of life is why symptom drugs exist. The percentage is not a textbook fact."
        },
        {
          "slide": "3",
          "claim": "Angina at 1 year linked to 32% higher cardiovascular death or infarction. CLARIFY.",
          "status": "SLIDE_PAPER",
          "say": "Persistent symptoms mark higher risk. This figure does not prove the drug prevents those deaths.",
          "locator": "Slide 3. Direction without 32%: Harrison L2-622, Davidson L2-164.",
          "ward": "Do not claim a mortality benefit.",
          "if_asked": "CLARIFY is observational."
        }
      ]
    },
    {
      "id": "6-12",
      "title": "Slides 6 to 12 — not one blocked artery",
      "bridge": "Ischaemia is a mismatch. A tight stenosis is the usual cause, not the only one.",
      "claims": [
        {
          "slide": "8",
          "claim": "CCS is a transient demand-supply mismatch from arteries and/or microcirculation.",
          "status": "SUPPORTED",
          "say": "Use the 2024 definition if challenged.",
          "locator": "ESC 2024 CCS PDF p9-10. Davidson L2-155. Harrison L2-610. Kumar L2-280.",
          "ward": "A definition is not a licence to call every chest pain ischaemia.",
          "if_asked": "Disease is the pathology. Syndrome is the presentation."
        },
        {
          "slide": "9",
          "claim": "About 50% have non-obstructive disease.",
          "status": "CONFLICT",
          "say": "Davidson says 10-20% of effort angina have normal coronaries. Selected no-obstruction meta-analysis: about 41% microvascular and 40% vasospastic.",
          "locator": "Davidson L2-156. ESC 2024 CCS PDF p31.",
          "ward": "Do not say Davidson or the guideline sentence is 50%.",
          "if_asked": "The slide graphic and the retrieved sentences are different facts."
        },
        {
          "slide": "12",
          "claim": "Nitrates worsen endothelium in spasm.",
          "status": "DO_NOT_SAY",
          "say": "Nitrates act on large vessels and preload. They relieve spasm acutely. Isolated spasm: calcium-channel blocker, Class I, Level A.",
          "locator": "Harrison L2-658. ESC 2024 CCS PDF p15.",
          "ward": "Do not repeat the endothelium clause as a book fact.",
          "if_asked": "The wrong first drug in isolated spasm is the beta-blocker."
        }
      ]
    },
    {
      "id": "15-18",
      "title": "Slides 15 to 18 — metabolism",
      "bridge": "Defend the direction of the fuel shift. Do not defend the percentage.",
      "claims": [
        {
          "slide": "18",
          "claim": "Trimetazidine gives +33% ATP.",
          "status": "DO_NOT_SAY",
          "say": "Harrison states the shift from fatty-acid oxidation toward glucose. The percentage is Filmore 2014 on the slide.",
          "locator": "Harrison L2-634. Slides 15-18 for +33%.",
          "ward": "Do not attribute +33% to Harrison or ESC.",
          "if_asked": "How much more ATP? The textbook does not give a percentage."
        }
      ]
    },
    {
      "id": "43-44",
      "title": "Slides 43 and 44 — class change",
      "bridge": "The downgrade is printed. The congress anecdote is not.",
      "claims": [
        {
          "slide": "43",
          "claim": "Class moved from IIa to IIb.",
          "status": "SUPPORTED",
          "say": "Nicorandil or trimetazidine may be considered, Class IIb. Nitrates and ranolazine stayed IIa.",
          "locator": "ESC 2024 CCS PDF p16 Table 4. Gap: PDF p84.",
          "ward": "IIb means may, not essential.",
          "if_asked": "Do not say the PDF declares the downgrade illegitimate."
        },
        {
          "slide": "44",
          "claim": "AHA agrees.",
          "status": "CONFLICT",
          "say": "AHA 2023 does not list trimetazidine and uses ranolazine. Ivabradine is Class 3 Harm if the ventricle is normal.",
          "locator": "AHA 2023 CCD PDF p51.",
          "ward": "Do not translate a European IIb into an American recommendation.",
          "if_asked": "Say AHA does not endorse this deck."
        }
      ]
    }
  ],
  "questions": [
    {
      "q": "Why IIb?",
      "a": "Table 4 downgraded it, and the guideline admits the ladder is not proved.",
      "locator": "ESC 2024 CCS PDF p16 and p84."
    },
    {
      "q": "Does it reduce death?",
      "a": "Not in these sources.",
      "locator": "ESC 2024 CCS PDF p46. Davidson L2-165."
    }
  ]
}
